{
  "v": "reelier.candidate-capture-report/v0",
  "status": "failed",
  "classification": "observed-only",
  "harness": {
    "id": "grok-bot",
    "instanceIdentityDigest": "sha256:98588fe4cc2caf1067ad2ef403eea9c6521d4118ca22c97a04a144c8efb3f46c"
  },
  "adapter": {
    "id": "xai.grok-bot",
    "instanceIdentityDigest": "sha256:98588fe4cc2caf1067ad2ef403eea9c6521d4118ca22c97a04a144c8efb3f46c"
  },
  "captureMode": "observed",
  "evidenceMode": "observed",
  "artifact": {
    "kind": "report",
    "rawDigest": "sha256:dd980a2b7477eb9db16fa6c0feeeda8c0b3fc5b8780f0f45eedafec0cfa45aa1"
  },
  "freshness": {
    "status": "fresh",
    "capturedAt": "2026-08-16T11:50:05.564Z",
    "freshUntil": "2026-08-17T11:50:05.563Z",
    "evaluatedAt": "2026-08-16T11:50:05.564Z"
  },
  "bindingDigest": "sha256:62da9bbfac21cf8b83baba8ec6f0e320d856eda3472bf084c70b1e9c1fc23c99",
  "reasonCodes": [
    "capture-boundary-non-passing",
    "capture-boundary-only",
    "live-harness-execution-not-proved",
    "observed-capture-non-passing",
    "route-enforcement-not-proved"
  ],
  "nonClaims": {
    "semanticConformance": "not-proved-by-capture",
    "liveHarnessExecution": "not-proved",
    "routeEnforcement": "not-proved",
    "outcomeCorrectness": "not-proved",
    "trafficCompleteness": "not-proved",
    "productionSafety": "not-proved"
  },
  "reportDigest": "sha256:acf7e4ea3bc5c943dec3a49f38242e394ca63a7acb3678c140215b9fbd32a301"
}
