{
  "v": "reelier.candidate-capture-report/v0",
  "status": "failed",
  "classification": "live-candidate-observed",
  "harness": {
    "id": "grok-bot",
    "instanceIdentityDigest": "sha256:f7803428accc5607c46eafeee946eee72bf079cb25a6842150752d2734b92057"
  },
  "adapter": {
    "id": "xai.grok-bot",
    "instanceIdentityDigest": "sha256:a99578033fcc21fc3d902cf28e16365cbb049b207e0d8c26b99c7a357ac91a4d"
  },
  "captureMode": "live-candidate",
  "evidenceMode": "observed",
  "artifact": {
    "kind": "report",
    "rawDigest": "sha256:42509c43cdf37d14c11406af7bc2a5bc19245a89bab631ee3de3b0314d5d79c4"
  },
  "freshness": {
    "status": "fresh",
    "capturedAt": "2026-08-16T12:50:19.742Z",
    "freshUntil": "2026-08-16T13:50:19.742Z",
    "evaluatedAt": "2026-08-16T12:50:19.743Z"
  },
  "bindingDigest": "sha256:90dd4c5c7303e2282237034a70ccd61e598d769a06fad90be855efd73971a1fc",
  "reasonCodes": [
    "capture-boundary-non-passing",
    "capture-boundary-only",
    "route-enforcement-not-proved"
  ],
  "nonClaims": {
    "semanticConformance": "not-proved-by-capture",
    "liveHarnessExecution": "candidate-supplied-not-proved",
    "routeEnforcement": "not-proved",
    "outcomeCorrectness": "not-proved",
    "trafficCompleteness": "not-proved",
    "productionSafety": "not-proved"
  },
  "reportDigest": "sha256:a21b5190a28da87de66a4e3dfae57cdca52d6eedabc1f3d677e4e5d8371e8748"
}
